<?xml version="1.0" encoding="UTF-8"?>
<Command xmlns:xsi="http://www.w3.org/2001/XMLSchema-instance" xsi:noNamespaceSchemaLocation="UpdateTransactionAnswer.xsd">
	<Header>
		<ReferenceNumber> 12345678</ReferenceNumber>
		<RequestNumber>7654321</RequestNumber>
		<SessionId>7777777</SessionId>
		<RequestType>Update</RequestType>
		<RequestSubType>CreateTransaction</RequestSubType>
		<ValueMsg>
			<ValuedQty>10</ValuedQty>
			<NonValuedQty>0</NonValuedQty>
		</ValueMsg>
	</Header>
	<CreateTransaction>
		<Error>
			<ErrorCode>0</ErrorCode>
			<ErrorShortDescription>OP_FAIL_CC_PAYM_NOT_APP</ErrorShortDescription>
			<ErrorDescription>CREDIT CARD PAYMENT NOT APPROVED</ErrorDescription>
		</Error>
	</CreateTransaction>
</Command>
